<?xml version="1.0" encoding="utf-8"?>
<xs:schema xmlns:xs="http://www.w3.org/2001/XMLSchema">
    <xs:complexType name="base_column">
        <xs:attribute name="name" type="xs:string" use="required"/>
    </xs:complexType>
    <xs:complexType name="data_column">
        <xs:simpleContent>
            <xs:extension base="xs:string">
                <xs:attribute name="name" type="xs:string" use="required"/>
            </xs:extension>
        </xs:simpleContent>
    </xs:complexType>
    <xs:complexType name="data_where">
        <xs:simpleContent>
            <xs:extension base="xs:string">
                <xs:attribute name="column" type="xs:string" use="required"/>
            </xs:extension>
        </xs:simpleContent>
    </xs:complexType>
    <xs:element name="database">
        <xs:complexType>
            <xs:sequence>
                <xs:element name="plugin" type="xs:string" minOccurs="1" maxOccurs="1"/>
                <xs:element name="tables" minOccurs="0" maxOccurs="1">
                    <xs:complexType>
                        <xs:sequence>
                            <xs:element name="table" minOccurs="1" maxOccurs="unbounded">
                                <xs:complexType>
                                    <xs:sequence>
                                        <xs:element name="columns" minOccurs="1" maxOccurs="1">
                                            <xs:complexType>
                                                <xs:sequence>
                                                    <xs:element name="column" minOccurs="1" maxOccurs="unbounded">
                                                        <xs:complexType>
                                                            <xs:attribute name="name" type="xs:string" use="required"/>
                                                            <xs:attribute name="datatype" type="xs:string" use="required"/>
                                                            <xs:attribute name="max" type="xs:integer" use="required"/>
                                                            <xs:attribute name="default" type="xs:string" use="required"/>
                                                        </xs:complexType>
                                                    </xs:element>
                                                </xs:sequence>
                                            </xs:complexType>
                                        </xs:element>
                                        <xs:element name="primary" minOccurs="1" maxOccurs="1">
                                            <xs:complexType>
                                                <xs:sequence>
                                                    <xs:element name="column" type="base_column" minOccurs="1" maxOccurs="unbounded"/>
                                                </xs:sequence>
                                            </xs:complexType>
                                        </xs:element>
                                        <xs:element name="uniques" minOccurs="0" maxOccurs="unbounded">
                                            <xs:complexType>
                                                <xs:sequence>
                                                    <xs:element name="unique" minOccurs="1" maxOccurs="unbounded">
                                                        <xs:complexType>
                                                            <xs:sequence>
                                                                <xs:element name="column" type="base_column" minOccurs="1" maxOccurs="unbounded"/>
                                                            </xs:sequence>
                                                            <xs:attribute name="name" type="xs:string" use="required"/>
                                                        </xs:complexType>
                                                    </xs:element>
                                                </xs:sequence>
                                            </xs:complexType>
                                        </xs:element>
                                        <xs:element name="indexes" minOccurs="0" maxOccurs="unbounded">
                                            <xs:complexType>
                                                <xs:sequence>
                                                    <xs:element name="index" minOccurs="1" maxOccurs="unbounded">
                                                        <xs:complexType>
                                                            <xs:sequence>
                                                                <xs:element name="column" type="base_column" minOccurs="1" maxOccurs="unbounded"/>
                                                            </xs:sequence>
                                                            <xs:attribute name="name" type="xs:string" use="required"/>
                                                        </xs:complexType>
                                                    </xs:element>
                                                </xs:sequence>
                                            </xs:complexType>
                                        </xs:element>
                                        <xs:element name="foreigns" minOccurs="0" maxOccurs="unbounded">
                                            <xs:complexType>
                                                <xs:sequence>
                                                    <xs:element name="foreign" minOccurs="1" maxOccurs="unbounded">
                                                        <xs:complexType>
                                                            <xs:sequence>
                                                                <xs:element name="column" minOccurs="1" maxOccurs="unbounded">
                                                                    <xs:complexType>
                                                                        <xs:attribute name="name" type="xs:string" use="required"/>
                                                                        <xs:attribute name="target" type="xs:string" use="required"/>
                                                                    </xs:complexType>
                                                                </xs:element>
                                                            </xs:sequence>
                                                            <xs:attribute name="table" type="xs:string" use="required"/>
                                                        </xs:complexType>
                                                    </xs:element>
                                                </xs:sequence>
                                            </xs:complexType>
                                        </xs:element>
                                    </xs:sequence>
                                    <xs:attribute name="name" type="xs:string" use="required"/>
                                </xs:complexType>
                            </xs:element>
                        </xs:sequence>
                    </xs:complexType>
                </xs:element>
                <xs:element name="data" minOccurs="0" maxOccurs="1">
                    <xs:complexType>
                        <xs:sequence>
                            <xs:element name="insert" minOccurs="0" maxOccurs="unbounded">
                                <xs:complexType>
                                    <xs:sequence>
                                        <xs:element name="column" type="data_column" minOccurs="1" maxOccurs="unbounded"/>
                                    </xs:sequence>
                                    <xs:attribute name="table" type="xs:string" use="required"/>
                                </xs:complexType>
                            </xs:element>
                            <xs:element name="update" minOccurs="0" maxOccurs="unbounded">
                                <xs:complexType>
                                    <xs:sequence>
                                        <xs:element name="column" type="data_column" minOccurs="1" maxOccurs="unbounded"/>
                                        <xs:element name="where" type="data_where" minOccurs="0" maxOccurs="unbounded"/>
                                    </xs:sequence>
                                    <xs:attribute name="table" type="xs:string" use="required"/>
                                </xs:complexType>
                            </xs:element>
                            <xs:element name="delete" minOccurs="0" maxOccurs="unbounded">
                                <xs:complexType>
                                    <xs:sequence>
                                        <xs:element name="where" type="data_where" minOccurs="1" maxOccurs="unbounded"/>
                                    </xs:sequence>
                                    <xs:attribute name="table" type="xs:string" use="required"/>
                                </xs:complexType>
                            </xs:element>
                        </xs:sequence>
                    </xs:complexType>
                </xs:element>
            </xs:sequence>
        </xs:complexType>
    </xs:element>
</xs:schema>
