<?xml version="1.0" encoding="utf-8" ?>
<database xmlns:xs="http://www.w3.org/2001/XMLSchema-instance"
    xs:noNamespaceSchemaLocation="http://www.csphere.eu/xml/schemas/database.xsd">
    <plugin>policies</plugin>
    <tables>
        <table name="policies">
            <columns>
                <column name="policie_id" datatype="serial" max="0" default="" />
                <column name="policie_content" datatype="longtext" max="0" default="" />
                <column name="policie_date" datatype="integer" max="14" default="" />
            </columns>
            <primary>
                <column name="policie_id" />
            </primary>
        </table>
    </tables>
    <data>
        <insert table="policies">
            <column name="policie_content">...</column>
            <column name="policie_date">1403096960</column>
        </insert>
        <insert table="policies">
            <column name="policie_content">...</column>
            <column name="policie_date">1403096960</column>
        </insert>
        <insert table="policies">
            <column name="policie_content">...</column>
            <column name="policie_date">1403096960</column>
        </insert>
    </data>
</database>
