<?xml version="1.0" encoding="utf-8" ?>
<database xmlns:xs="http://www.w3.org/2001/XMLSchema-instance"
    xs:noNamespaceSchemaLocation="http://www.csphere.eu/xml/schemas/database.xsd">
    <plugin>blog</plugin>
    <tables>
        <table name="blog">
            <columns>
                <column name="blog_id" datatype="serial" max="0" default="" />
                <column name="user_id" datatype="integer" default="0"/>
                <column name="blog_title" datatype="varchar" max="120" default="" />
                <column name="blog_content" datatype="longtext" default="" />
                <column name="blog_date" datatype="integer" max="14" default="" />
                <column name="blog_publish" datatype="integer" max="2" default="0" />
            </columns>
            <primary>
                <column name="blog_id" />
            </primary>
            <uniques>
                <unique name="blog_title">
                    <column name="blog_title" />
                </unique>
            </uniques>
        </table>
    </tables>
    <data>
        <insert table="options">
            <column name="option_plugin">blog</column>
            <column name="option_name">title_length_list</column>
            <column name="option_value">25</column>
        </insert>
        <insert table="options">
            <column name="option_plugin">blog</column>
            <column name="option_name">title_length_manage</column>
            <column name="option_value">25</column>
        </insert>
    </data>
</database>
